{
  "schema_version": "1.0",
  "run_id": "20260923-180441-3e36d8",
  "workflow_id": "novel-3ch.chapters",
  "status": "completed",
  "phase": "executing",
  "started_at": "2026-09-23T18:04:41",
  "ended_at": "2026-09-23T19:43:15",
  "duration_ms": 5914928,
  "inputs": {
    "theme": "末世/重生",
    "chapters_file": "novel/plan/chapters.json",
    "outline_file": "novel/plan/outline.md",
    "item": {
      "number": 2,
      "title": "黎明前的獠牙",
      "summary": "末世两周，楼内避难者成分复杂，楼长老魏偷接掠夺者“黎明先遣队”，出卖林昭的物资。林昭将计就计设伏击退偷袭者，跨过杀人的心理关；又救下被据点追杀的通讯兵苏晓，得知前世仇人陈竞正在附近搜刮。据点强攻居民楼，陆野为护伤员受伤，敌众我寡，林昭决定险中求胜。",
      "key_events": [
        "楼内分配物资起冲突，林昭察觉楼长老魏深夜外出、行踪诡秘",
        "识破老魏勾结黎明先遣队，林昭在楼道暗角设伏击退偷袭者",
        "救下被据点追杀、背负电台的女通讯兵苏晓",
        "从苏晓口中得知陈竞已成为黎明据点头目，正率主力在本区搜刮",
        "据点强攻居民楼，陆野为护苏晓被钢管砸伤，林昭决定主动设局反击"
      ]
    },
    "index": 1
  },
  "context": {
    "theme": "末世/重生",
    "chapters_file": "novel/plan/chapters.json",
    "outline_file": "novel/plan/outline.md",
    "item": {
      "number": 2,
      "title": "黎明前的獠牙",
      "summary": "末世两周，楼内避难者成分复杂，楼长老魏偷接掠夺者“黎明先遣队”，出卖林昭的物资。林昭将计就计设伏击退偷袭者，跨过杀人的心理关；又救下被据点追杀的通讯兵苏晓，得知前世仇人陈竞正在附近搜刮。据点强攻居民楼，陆野为护伤员受伤，敌众我寡，林昭决定险中求胜。",
      "key_events": [
        "楼内分配物资起冲突，林昭察觉楼长老魏深夜外出、行踪诡秘",
        "识破老魏勾结黎明先遣队，林昭在楼道暗角设伏击退偷袭者",
        "救下被据点追杀、背负电台的女通讯兵苏晓",
        "从苏晓口中得知陈竞已成为黎明据点头目，正率主力在本区搜刮",
        "据点强攻居民楼，陆野为护苏晓被钢管砸伤，林昭决定主动设局反击"
      ]
    },
    "index": 1,
    "draft": {
      "$file": "novel/chapter-2.md",
      "title": "黎明前的獠牙",
      "word_count": 872
    },
    "chapter": {
      "$file": "novel/chapter-2.md",
      "title": "黎明前的獠牙",
      "word_count": 872
    }
  },
  "next_node": null,
  "node_started_at": null,
  "error": null,
  "last_feedback": null,
  "pending_review": null,
  "revision": null,
  "node_runs": [
    {
      "node_id": "start",
      "node_name": "start",
      "type": "start",
      "status": "success",
      "started_at": "2026-09-23T18:04:41",
      "ended_at": "2026-09-23T18:05:35",
      "duration_ms": 54554,
      "model": null,
      "tokens": null,
      "decision": null,
      "feedback": null,
      "revision_seq": null,
      "input": null,
      "summary": "",
      "output": null
    },
    {
      "node_id": "write-chapter",
      "node_name": "撰写章节正文",
      "type": "task",
      "status": "success",
      "started_at": "2026-09-23T18:05:35",
      "ended_at": "2026-09-23T18:07:23",
      "duration_ms": 108582,
      "model": null,
      "tokens": null,
      "decision": null,
      "feedback": null,
      "revision_seq": null,
      "input": {
        "prompt": "你在连载一篇 末世/重生 短篇小说。先用读文件工具读取章节清单 novel/plan/chapters.json（JSON 数组），取序号为 1 的那一项（0 基下标），得到本章的 number、title、summary、key_events；再读取大纲 novel/plan/outline.md 了解全书设定。按该条目规格撰写本章正文。要求：1) 正文 800-1200 字（按汉字计），本章自成段落又能与相邻章节衔接；2) 末世氛围与重生金手指设定必须与大纲一致，不得引入大纲之外的重大设定；3) 将正文（首行为章节标题）写入文件 novel/chapter-<number>.md（number 取条目字段）；4) 完成后只输出 JSON：{\"$file\":\"novel/chapter-<number>.md 的实际路径\",\"title\":本章标题,\"word_count\":实际字数}。不要在输出中粘贴正文。"
      },
      "summary": "{\"$file\": \"novel/chapter-2.md\", \"title\": \"黎明前的獠牙\", \"word_count\": 872}",
      "output": {
        "$file": "novel/chapter-2.md",
        "title": "黎明前的獠牙",
        "word_count": 872
      }
    },
    {
      "node_id": "chapter-qc",
      "node_name": "章节自动质检",
      "type": "branch",
      "status": "success",
      "started_at": "2026-09-23T18:07:24",
      "ended_at": "2026-09-23T19:42:50",
      "duration_ms": 5726065,
      "model": null,
      "tokens": null,
      "decision": {
        "answer": "PASS",
        "route": "finish-chapter"
      },
      "feedback": null,
      "revision_seq": null,
      "input": {
        "prompt": "你是章节自动质检 agent。先读取章节清单 novel/plan/chapters.json，取序号为 1 的项（0 基）得到本章 number、title、key_events；再用读文件工具读取 novel/chapter-<number>.md 与大纲 novel/plan/outline.md，检查：1) 字数是否在 800-1200 之间；2) 是否完整覆盖该项的 key_events；3) 世界观设定与大纲是否一致、与相邻章节是否连贯；4) 文笔与末世/重生氛围是否到位。全部合格只回答 PASS；任一不合格只回答 REVISE。不要输出任何其它内容。"
      },
      "summary": "PASS",
      "output": "PASS"
    },
    {
      "node_id": "finish-chapter",
      "node_name": "章节定稿",
      "type": "task",
      "status": "success",
      "started_at": "2026-09-23T19:42:50",
      "ended_at": "2026-09-23T19:43:03",
      "duration_ms": 13024,
      "model": null,
      "tokens": null,
      "decision": null,
      "feedback": null,
      "revision_seq": null,
      "input": {
        "prompt": "本章自动质检已通过。先读取章节清单 novel/plan/chapters.json，取序号为 1 的项（0 基）得到本章 number、title；再用读文件工具读取 novel/chapter-<number>.md 确认文件存在、内容完整，统计实际字数，确认与大纲 novel/plan/outline.md 的设定一致。只输出 JSON：{\"$file\":\"该文件实际路径\",\"title\":本章标题,\"word_count\":实际字数}。不要在输出中粘贴正文。"
      },
      "summary": "{\"$file\": \"novel/chapter-2.md\", \"title\": \"黎明前的獠牙\", \"word_count\": 872}",
      "output": {
        "$file": "novel/chapter-2.md",
        "title": "黎明前的獠牙",
        "word_count": 872
      }
    },
    {
      "node_id": "end",
      "node_name": "end",
      "type": "end",
      "status": "success",
      "started_at": "2026-09-23T19:43:03",
      "ended_at": "2026-09-23T19:43:15",
      "duration_ms": 12928,
      "model": null,
      "tokens": null,
      "decision": null,
      "feedback": null,
      "revision_seq": null,
      "input": null,
      "summary": "",
      "output": null
    }
  ],
  "events": [
    {
      "type": "run_started",
      "at": "2026-09-23T18:04:41"
    }
  ],
  "parent": {
    "workflow_id": "novel-3ch",
    "run_id": "20260923-174619-840522",
    "node_id": "chapters",
    "instance": "2"
  },
  "subflow_state": null
}
