{
  "schema_version": "1.0",
  "run_id": "20261005-203110-a9944f",
  "workflow_id": "plan-task.work",
  "status": "completed",
  "phase": "executing",
  "started_at": "2026-10-05T20:31:10",
  "ended_at": "2026-10-05T20:31:10",
  "duration_ms": 986,
  "inputs": {
    "plan": {
      "$file": "plan/wu-gang-ch1/plan.md",
      "summary": "计划已制定：2 个任务，队列已封口",
      "task_count": 2
    },
    "intake": {
      "goal": "做出《雾港》第一章可玩的垂直切片",
      "scope": "码头探索 + 潮汐谜题 + 道具合成 + 关门通关，一条单章节闭环",
      "constraints": "两周内完成；只用现有美术素材；不引入新的第三方库",
      "acceptance": "玩家能从码头走到通关且全程无阻断；谜题 / 合成 / 关门三条链路可独立复现；手感与氛围达到可展示标准",
      "plan_name": "wu-gang-ch1"
    },
    "previous": null,
    "item": {
      "id": "TASK-001",
      "name": "核心循环 spec",
      "goal": "把探索-解谜-合成-通关的核心循环写成可执行规格",
      "deps": "无",
      "acceptance": "循环每一环都有明确的输入输出与状态迁移"
    },
    "index": 0
  },
  "context": {
    "plan": {
      "$file": "plan/wu-gang-ch1/plan.md",
      "summary": "计划已制定：2 个任务，队列已封口",
      "task_count": 2
    },
    "intake": {
      "goal": "做出《雾港》第一章可玩的垂直切片",
      "scope": "码头探索 + 潮汐谜题 + 道具合成 + 关门通关，一条单章节闭环",
      "constraints": "两周内完成；只用现有美术素材；不引入新的第三方库",
      "acceptance": "玩家能从码头走到通关且全程无阻断；谜题 / 合成 / 关门三条链路可独立复现；手感与氛围达到可展示标准",
      "plan_name": "wu-gang-ch1"
    },
    "previous": null,
    "item": {
      "id": "TASK-001",
      "name": "核心循环 spec",
      "goal": "把探索-解谜-合成-通关的核心循环写成可执行规格",
      "deps": "无",
      "acceptance": "循环每一环都有明确的输入输出与状态迁移"
    },
    "index": 0,
    "run": {
      "id": "20261005-203110-a9944f",
      "dir": ".aiwf\\runs\\plan-task\\20261005-203108-d85a1c\\children\\work\\TASK-001"
    },
    "execute": {
      "$file": "plan/wu-gang-ch1/tasks/TASK-001.md",
      "summary": "核心循环 spec 完成并自检达标"
    }
  },
  "next_node": null,
  "node_started_at": null,
  "error": null,
  "last_feedback": null,
  "pending_review": null,
  "revision": null,
  "node_runs": [
    {
      "node_id": "start",
      "node_name": "start",
      "type": "start",
      "status": "success",
      "started_at": "2026-10-05T20:31:10",
      "ended_at": "2026-10-05T20:31:10",
      "duration_ms": 187,
      "model": null,
      "tokens": null,
      "decision": null,
      "feedback": null,
      "revision_seq": null,
      "input": null,
      "summary": "",
      "output": null
    },
    {
      "node_id": "execute",
      "node_name": "执行与自检",
      "type": "task",
      "status": "success",
      "started_at": "2026-10-05T20:31:10",
      "ended_at": "2026-10-05T20:31:10",
      "duration_ms": 383,
      "model": null,
      "tokens": null,
      "decision": null,
      "feedback": null,
      "revision_seq": null,
      "input": {
        "prompt": "按 task.goal 实施本任务改动；previous 非空时先读上一任务的交接文件，保持衔接。改动完成后自查 task.acceptance 的每条验收点。把「改动说明（做了什么 / 关键决定 / 遗留风险）+ 自检结论」写成一份文件，输出 {$file, summary}。",
        "inputs": {
          "task": {
            "id": "TASK-001",
            "name": "核心循环 spec",
            "goal": "把探索-解谜-合成-通关的核心循环写成可执行规格",
            "deps": "无",
            "acceptance": "循环每一环都有明确的输入输出与状态迁移"
          },
          "plan": {
            "$file": "plan/wu-gang-ch1/plan.md",
            "summary": "计划已制定：2 个任务，队列已封口",
            "task_count": 2
          },
          "intake": {
            "goal": "做出《雾港》第一章可玩的垂直切片",
            "scope": "码头探索 + 潮汐谜题 + 道具合成 + 关门通关，一条单章节闭环",
            "constraints": "两周内完成；只用现有美术素材；不引入新的第三方库",
            "acceptance": "玩家能从码头走到通关且全程无阻断；谜题 / 合成 / 关门三条链路可独立复现；手感与氛围达到可展示标准",
            "plan_name": "wu-gang-ch1"
          },
          "previous": null
        }
      },
      "summary": "{\"$file\": \"plan/wu-gang-ch1/tasks/TASK-001.md\", \"summary\": \"核心循环 spec 完成并自检达标\"}",
      "output": {
        "$file": "plan/wu-gang-ch1/tasks/TASK-001.md",
        "summary": "核心循环 spec 完成并自检达标"
      }
    },
    {
      "node_id": "end",
      "node_name": "end",
      "type": "end",
      "status": "success",
      "started_at": "2026-10-05T20:31:10",
      "ended_at": "2026-10-05T20:31:10",
      "duration_ms": 986,
      "model": null,
      "tokens": null,
      "decision": null,
      "feedback": null,
      "revision_seq": null,
      "input": null,
      "summary": "",
      "output": null
    }
  ],
  "events": [
    {
      "type": "run_started",
      "at": "2026-10-05T20:31:10"
    },
    {
      "type": "check_requested",
      "at": "2026-10-05T20:31:10",
      "node_id": "execute",
      "attempt": 1
    },
    {
      "type": "check_decided",
      "at": "2026-10-05T20:31:10",
      "node_id": "execute",
      "attempt": 1,
      "verdict": "PASS",
      "reason": "逐条核对验收点，达标",
      "started_at": "2026-10-05T20:31:10",
      "duration_ms": 691,
      "input": {
        "criteria": [
          "改动覆盖 task.acceptance 的验收点",
          "自检结论逐条对应验收点，有据可查"
        ],
        "output": {
          "$file": "plan/wu-gang-ch1/tasks/TASK-001.md",
          "summary": "核心循环 spec 完成并自检达标"
        }
      },
      "output": {
        "verdict": "PASS",
        "reason": "逐条核对验收点，达标"
      },
      "summary": "{\"verdict\": \"PASS\", \"reason\": \"逐条核对验收点，达标\"}"
    },
    {
      "type": "review_requested",
      "at": "2026-10-05T20:31:10",
      "node_id": "execute",
      "requirements": [
        "任务目标达成，产物可交付",
        "与计划范围不冲突"
      ]
    },
    {
      "type": "review_decided",
      "at": "2026-10-05T20:31:10",
      "node_id": "execute",
      "verdict": "APPROVE",
      "feedback": "仿真验收通过"
    }
  ],
  "parent": {
    "workflow_id": "plan-task",
    "run_id": "20261005-203108-d85a1c",
    "node_id": "work",
    "instance": "TASK-001"
  },
  "subflow_state": null,
  "workflow_version": "1.1",
  "activation_id": "20261005-203110-879b7a",
  "pending_check": null
}
