{
  "schema_version": "1.0",
  "run_id": "20261005-203343-0ef2fc",
  "workflow_id": "plan-task",
  "status": "running",
  "phase": "executing",
  "started_at": "2026-10-05T20:33:43",
  "ended_at": null,
  "duration_ms": null,
  "inputs": {
    "requirement": "我想给这款雾港题材的横版解谜游戏做一个『第一章可玩的垂直切片』：玩家能在码头探索、触发并解开潮汐谜题、合成一件关键道具、并走通关门通关的完整闭环；手感和氛围要能一眼看出成色。约束：两周内完成、只用现有美术素材、不引入新的第三方库。"
  },
  "context": {
    "requirement": "我想给这款雾港题材的横版解谜游戏做一个『第一章可玩的垂直切片』：玩家能在码头探索、触发并解开潮汐谜题、合成一件关键道具、并走通关门通关的完整闭环；手感和氛围要能一眼看出成色。约束：两周内完成、只用现有美术素材、不引入新的第三方库。",
    "run": {
      "id": "20261005-203343-0ef2fc",
      "dir": ".aiwf\\runs\\plan-task\\20261005-203343-0ef2fc"
    }
  },
  "next_node": "intake",
  "node_started_at": "2026-10-05T20:33:43",
  "error": null,
  "last_feedback": null,
  "pending_review": null,
  "revision": null,
  "node_runs": [],
  "events": [
    {
      "type": "run_started",
      "at": "2026-10-05T20:33:43"
    }
  ],
  "parent": null,
  "subflow_state": null,
  "workflow_version": "1.1",
  "activation_id": "20261005-203343-34d8b2"
}
